{
  "$schema": "../schema/liquid-scene-v2.schema.json",
  "schemaVersion": 2,
  "id": "spinner-to-ad",
  "fixtureVersion": 1,
  "durationMs": 1900,
  "coordinateSpace": {
    "width": 528,
    "height": 207
  },
  "fillRule": "nonzero",
  "tracks": [
    {
      "id": "spinner-left-to-a",
      "source": {
        "assetId": "addy-spinner",
        "shapeId": "bar-left",
        "transform": {
          "translateX": 52.3954,
          "translateY": -12.4297,
          "scaleX": 1,
          "scaleY": 1
        },
        "commands": [
          {
            "type": "M",
            "values": [
              27.0996,
              22.8516
            ]
          },
          {
            "type": "C",
            "values": [
              42.0663,
              22.8516,
              54.1992,
              34.9845,
              54.1992,
              49.9512
            ]
          },
          {
            "type": "L",
            "values": [
              54.1992,
              104.15
            ]
          },
          {
            "type": "C",
            "values": [
              54.1992,
              119.117,
              42.0664,
              131.251,
              27.0996,
              131.251
            ]
          },
          {
            "type": "C",
            "values": [
              12.1329,
              131.251,
              0,
              119.117,
              0,
              104.15
            ]
          },
          {
            "type": "L",
            "values": [
              0,
              49.9512
            ]
          },
          {
            "type": "C",
            "values": [
              0.000049,
              34.9845,
              12.1329,
              22.8516,
              27.0996,
              22.8516
            ]
          },
          {
            "type": "Z"
          }
        ]
      },
      "target": {
        "assetId": "addy-wordmark",
        "shapeId": "letter-a",
        "transform": {
          "translateX": 0,
          "translateY": 0,
          "scaleX": 1,
          "scaleY": 1
        },
        "commands": [
          {
            "type": "M",
            "values": [
              0,
              161.43
            ]
          },
          {
            "type": "L",
            "values": [
              56.1013,
              10.4219
            ]
          },
          {
            "type": "L",
            "values": [
              103.111,
              10.4219
            ]
          },
          {
            "type": "L",
            "values": [
              158.991,
              161.43
            ]
          },
          {
            "type": "L",
            "values": [
              111.094,
              161.43
            ]
          },
          {
            "type": "L",
            "values": [
              102.89,
              134.377
            ]
          },
          {
            "type": "L",
            "values": [
              53.4403,
              134.377
            ]
          },
          {
            "type": "L",
            "values": [
              44.5706,
              161.43
            ]
          },
          {
            "type": "L",
            "values": [
              0,
              161.43
            ]
          },
          {
            "type": "Z"
          },
          {
            "type": "M",
            "values": [
              64.971,
              99.5631
            ]
          },
          {
            "type": "L",
            "values": [
              92.4673,
              99.5631
            ]
          },
          {
            "type": "L",
            "values": [
              79.3844,
              56.1012
            ]
          },
          {
            "type": "L",
            "values": [
              64.971,
              99.5631
            ]
          },
          {
            "type": "Z"
          }
        ]
      },
      "timing": {
        "start": 0,
        "end": 0.78
      },
      "components": [
        {
          "id": "a-left-leg",
          "kind": "capsule",
          "operation": "union",
          "groupId": "a-body"
        },
        {
          "id": "a-right-leg",
          "kind": "capsule",
          "operation": "union",
          "groupId": "a-body"
        },
        {
          "id": "a-crossbar",
          "kind": "capsule",
          "operation": "union",
          "groupId": "a-crossbar"
        },
        {
          "id": "a-adhesion",
          "kind": "ribbon",
          "operation": "union",
          "groupId": "a-bridge"
        }
      ],
      "keyframes": [
        {
          "at": 0,
          "easing": "linear",
          "components": [
            {
              "id": "a-left-leg",
              "primitive": {
                "kind": "capsule",
                "start": {
                  "x": 79.495,
                  "y": 37.5215
                },
                "end": {
                  "x": 79.495,
                  "y": 91.7217
                },
                "radius": 27.0996
              }
            },
            {
              "id": "a-right-leg",
              "primitive": {
                "kind": "capsule",
                "start": {
                  "x": 79.495,
                  "y": 37.5215
                },
                "end": {
                  "x": 79.495,
                  "y": 91.7217
                },
                "radius": 27.0996
              }
            },
            {
              "id": "a-crossbar",
              "primitive": {
                "kind": "capsule",
                "start": {
                  "x": 79.495,
                  "y": 80.4219
                },
                "end": {
                  "x": 79.495,
                  "y": 80.4219
                },
                "radius": 0
              }
            },
            {
              "id": "a-adhesion",
              "primitive": {
                "kind": "ribbon",
                "p0": {
                  "x": 79.495,
                  "y": 98.4219
                },
                "p1": {
                  "x": 79.495,
                  "y": 98.4219
                },
                "p2": {
                  "x": 79.495,
                  "y": 98.4219
                },
                "p3": {
                  "x": 79.495,
                  "y": 98.4219
                },
                "startRadius": 0,
                "endRadius": 0
              }
            }
          ],
          "material": {
            "groups": {
              "$track": {
                "targetMix": 0,
                "cornerSharpness": 0,
                "blendRadius": 0
              },
              "a-body": {
                "blendRadius": 0
              },
              "a-crossbar": {
                "blendRadius": 0
              },
              "a-bridge": {
                "blendRadius": 0
              }
            }
          }
        },
        {
          "at": 0.2,
          "easing": "smoothStep",
          "components": [
            {
              "id": "a-left-leg",
              "primitive": {
                "kind": "capsule",
                "start": {
                  "x": 79.495,
                  "y": 36.4219
                },
                "end": {
                  "x": 76,
                  "y": 101.4219
                },
                "radius": 24.5
              }
            },
            {
              "id": "a-right-leg",
              "primitive": {
                "kind": "capsule",
                "start": {
                  "x": 79.495,
                  "y": 36.4219
                },
                "end": {
                  "x": 83,
                  "y": 101.4219
                },
                "radius": 24.5
              }
            },
            {
              "id": "a-crossbar",
              "primitive": {
                "kind": "capsule",
                "start": {
                  "x": 74,
                  "y": 80.4219
                },
                "end": {
                  "x": 85,
                  "y": 80.4219
                },
                "radius": 3
              }
            },
            {
              "id": "a-adhesion",
              "primitive": {
                "kind": "ribbon",
                "p0": {
                  "x": 74,
                  "y": 96.4219
                },
                "p1": {
                  "x": 77,
                  "y": 94.4219
                },
                "p2": {
                  "x": 82,
                  "y": 94.4219
                },
                "p3": {
                  "x": 85,
                  "y": 96.4219
                },
                "startRadius": 8,
                "endRadius": 8
              }
            }
          ],
          "material": {
            "groups": {
              "$track": {
                "targetMix": 0,
                "cornerSharpness": 0,
                "blendRadius": 8
              },
              "a-body": {
                "blendRadius": 8
              },
              "a-crossbar": {
                "blendRadius": 4.4
              },
              "a-bridge": {
                "blendRadius": 6
              }
            }
          }
        },
        {
          "at": 0.4,
          "easing": "smoothStep",
          "components": [
            {
              "id": "a-left-leg",
              "primitive": {
                "kind": "capsule",
                "start": {
                  "x": 79.495,
                  "y": 34.4219
                },
                "end": {
                  "x": 59,
                  "y": 129.4219
                },
                "radius": 20.5
              }
            },
            {
              "id": "a-right-leg",
              "primitive": {
                "kind": "capsule",
                "start": {
                  "x": 79.495,